Label,Description,URL,Category,Sector,Purpose,Activities,Tags,Digital Harms Addressed,Tech Focus,Supported identity technologies,Parent Org,Me2Be Relationship,People,Audience,Partners,Working group,License,Frequency?,Version or Edition,Start Date,End Date,Status,Annual Budget,Funding ,Scope,Location(s),Products and or services,Twitter Profile,LinkedIn Profile,Github Profile,Relevant Publications,,,,,,,,,,,,,,,,,,,,,Label,Description,URL,Category,Sector,Purpose,Activities,Tags,Digital Harms Addressed,Tech Focus,Supported identity technologies,Parent Org,Me2Be Relationship,People,Audience,Partners,Working group,License,Frequency?,Version or Edition,Start Date,End Date,Status,Annual Budget,Funding ,Scope,Location(s),Products and or services,Twitter Profile,LinkedIn Profile,Github Profile,Relevant Publications,,,,,,,,,,,,,,,,,,,,,Label,Description,URL,Category,Sector,Purpose,Activities,Tags,Digital Harms Addressed,Tech Focus,Supported identity technologies,Parent Org,Me2Be Relationship,People,Audience,Partners,Working group,License,Frequency?,Version or Edition,Start Date,End Date,Status,Annual Budget,Funding ,Scope,Location(s),Products and or services,Twitter Profile,LinkedIn Profile,Github Profile,Relevant Publications,,,,,,,,,,,,,,,,,,,,,Label,Description,URL,Category,Sector,Purpose,Activities,Tags,Digital Harms Addressed,Tech Focus,Supported identity technologies,Parent Org,Me2Be Relationship,People,Audience,Partners,Working group,License,Frequency?,Version or Edition,Start Date,End Date,Status,Annual Budget,Funding ,Scope,Location(s),Products and or services,Twitter Profile,LinkedIn Profile,Github Profile,Relevant Publications
Name,About,URL,Publication Type,Sector,Purpose,,TAGS,Digital Harms Addressed,TechFocus,,Sponsoring Org,,Author(s)/Editors,Audience,,Working group,License,Volume Frequency,Version or Edition,Date,,Status,,,,Jurisdiction,,,,Github Profile,,,,,,,,,,,,,,,,,,,,,,,,,,,,,,,,,,,,,,,,,,,,,,,,,,,,,,,,,,,,,,,,,,,,,,,,,,,,,,,,,,,,,,,,,,,,,,,,,,,,,,,,,,,,,,,,,,,,,,,,,,,,,,,,,,,,,,,,,,,,,,,,,,,,,,,,,,,,,
Name,About,URL,Publication Type,Sector,Purpose,,TAGS,Digital Harms Addressed,TechFocus,,Sponsoring Org,,Author(s)/Editors,Audience,,Working group,License,Volume Frequency,Version or Edition,Date,,Status,,,,Jurisdiction,,,,Github Profile,,,,,,,,,,,,,,,,,,,,,,,,,,,,,,,,,,,,,,,,,,,,,,,,,,,,,,,,,,,,,,,,,,,,,,,,,,,,,,,,,,,,,,,,,,,,,,,,,,,,,,,,,,,,,,,,,,,,,,,,,,,,,,,,,,,,,,,,,,,,,,,,,,,,,,,,,,,,,
Good ID Glossary ,,https://www.good-id.org/en/,Glossary,,,,,,,,Good ID,,,,,,,,,,,,,,,,,,,,,,,,,,,,,,,,,,,,,,,,,,,,,,,,,,,,,,,,,,,,,,,,,,,,,,,,,,,,,,,,,,,,,,,,,,,,,,,,,,,,,,,,,,,,,,,,,,,,,,,,,,,,,,,,,,,,,,,,,,,,,,,,,,,,,,,,,,,,,,,,,,,,,,,,,,,,,,,,
RDR Corporate Accountability Index,,RDR Corporate Accountability Index,report,,,,,,,,Ranking Digital Rights,,,,,,,,,,,,,,,,,,,,,,,,,,,,,,,,,,,,,,,,,,,,,,,,,,,,,,,,,,,,,,,,,,,,,,,,,,,,,,,,,,,,,,,,,,,,,,,,,,,,,,,,,,,,,,,,,,,,,,,,,,,,,,,,,,,,,,,,,,,,,,,,,,,,,,,,,,,,,,,,,,,,,,,,,,,,,,,,
Creative Common licensing terms,,https://creativecommons.org/share-your-work/   ,Terms,,,,,,,,Creative Commons,,,,,,,,,,,,,,,,,,,,,,,,,,,,,,,,,,,,,,,,,,,,,,,,,,,,,,,,,,,,,,,,,,,,,,,,,,,,,,,,,,,,,,,,,,,,,,,,,,,,,,,,,,,,,,,,,,,,,,,,,,,,,,,,,,,,,,,,,,,,,,,,,,,,,,,,,,,,,,,,,,,,,,,,,,,,,,,,
Building a Consentful Economy: A report on Developments and Trends relevant to building consent-based digital services.,"In April 2017 we convened a workshop of stakeholders from across academia: business and regulation to consider developments and directions related to ""consentful"" use of personal data. This report summarises and sysnthesises our discussions from those two days as a means of encouraging conversation and collaboration: and acting as a roadmap for the development of a digital economy that puts individuals in control. Five Pillars Five 'pillars' are crucial to the development of a consentful digital economy; developments are required in all five: and they reinforce (or weaken) one another.",http://www.meaningfulconsent.org/reports/2017/consentful_economy/,report,,,,,,,,Meaningful Consent,Content source for Me2B Certification?,,government workers,,,,,,,,Completed: Inactive?,,,,,,,,,,,,,,,,,,,,,,,,,,,,,,,,,,,,,,,,,,,,,,,,,,,,,,,,,,,,,,,,,,,,,,,,,,,,,,,,,,,,,,,,,,,,,,,,,,,,,,,,,,,,,,,,,,,,,,,,,,,,,,,,,,,,,,,,,,,,,,,,,,,,,,,,,,,,,,,,,,,,,
Docracy,Open Legal document repository,https://www.docracy.com/,legal document,,,,,,,,Docracy,,,,,,,,,,,,,,,,,,,,,,,,,,,,,,,,,,,,,,,,,,,,,,,,,,,,,,,,,,,,,,,,,,,,,,,,,,,,,,,,,,,,,,,,,,,,,,,,,,,,,,,,,,,,,,,,,,,,,,,,,,,,,,,,,,,,,,,,,,,,,,,,,,,,,,,,,,,,,,,,,,,,,,,,,,,,,,,,
The Ethics Certification Program for Autonomous and Intelligent Systems (ECPAIS),,https://standards.ieee.org/industry-connections/ecpais.html,Certification,,,,,,,,The Ethics Certification Program for Autonomous and Intelligent Systems (ECPAIS),,,,,,,,,,,,,,,,,,,,,,,,,,,,,,,,,,,,,,,,,,,,,,,,,,,,,,,,,,,,,,,,,,,,,,,,,,,,,,,,,,,,,,,,,,,,,,,,,,,,,,,,,,,,,,,,,,,,,,,,,,,,,,,,,,,,,,,,,,,,,,,,,,,,,,,,,,,,,,,,,,,,,,,,,,,,,,,,
Free Software Foundation,Free Software Definition,https://www.fsf.org/resources/hw/endorsement/respects-your-freedom ,Glossary,,,,,,,,Free Software Foundation,,Richard Stallman,,,,,,,,,,,,,,,,,,,,,,,,,,,,,,,,,,,,,,,,,,,,,,,,,,,,,,,,,,,,,,,,,,,,,,,,,,,,,,,,,,,,,,,,,,,,,,,,,,,,,,,,,,,,,,,,,,,,,,,,,,,,,,,,,,,,,,,,,,,,,,,,,,,,,,,,,,,,,,,,,,,,,,,,,,,,,,
Free Software Foundation,GNU GPL,https://www.fsf.org/resources/hw/endorsement/respects-your-freedom ,Legal Document,,,,,,,,Free Software Foundation,,Richard Stallman,,,,,,,,,,,,,,,,,,,,,,,,,,,,,,,,,,,,,,,,,,,,,,,,,,,,,,,,,,,,,,,,,,,,,,,,,,,,,,,,,,,,,,,,,,,,,,,,,,,,,,,,,,,,,,,,,,,,,,,,,,,,,,,,,,,,,,,,,,,,,,,,,,,,,,,,,,,,,,,,,,,,,,,,,,,,,,
DISCRIMINATING SYSTEMS:  Gender: Race: and Power in AI,"The diversity problems of the AI industry and the issues of bias in AI systems tend to be considered separately. In this report we suggest that they are two sides of the same problem: issues of discrimination in the workforce and in system building are deeply related. Moreover: tackling the challenges of bias within technical systems requires addressing workforce diversity: and vice versa. Our research points to new ways of understanding the relationships between these complex problems: which can open up new pathways to redressing the current imbalances and harms.
Drawing on a thorough review of existing literature and current research working on issues of gender: race: class: and artificial intelligence: this pilot study examines the scale of AI’s current diversity crisis and possible paths forward. It represents the first stage of a multi-year project examining the intersection of gender: race and power in AI.",https://ainowinstitute.org/ discriminatingsystems.html.,report,,,,,,,,AI Now Institute,,Sarah Myers West: Meredith Whittaker: Kate Crawford: ,,,West: ,,,,,,,,,,,,,,,,,,,,,,,,,,,,,,,,,,,,,,,,,,,,,,,,,,,,,,,,,,,,,,,,,,,,,,,,,,,,,,,,,,,,,,,,,,,,,,,,,,,,,,,,,,,,,,,,,,,,,,,,,,,,,,,,,,,,,,,,,,,,,,,,,,,,,,,,,,,,,,,,,,,,,,,,,,,
The Data Portability Cooperation WhitePaper,"The Data Portability Cooperation
The DPC is an inclusive working group led by GSMA and major European Telecommunications operators Orange: Telefónica and Deutsche Telekom to build the first specification of personal data portability for the telco industry.
The initiative is open by nature and encourage other telecommunication operators to join the discussions within the GSMA or the other industries to contribute by contacting us",https://www.dataportabilitycooperation.org/assets/Telecoms_Secured_Data_Hub.pdf,report,,,Data Portability,,,,,,,,,,,,,,,,,,,,,,,,,,,,,,,,,,,,,,,,,,,,,,,,,,,,,,,,,,,,,,,,,,,,,,,,,,,,,,,,,,,,,,,,,,,,,,,,,,,,,,,,,,,,,,,,,,,,,,,,,,,,,,,,,,,,,,,,,,,,,,,,,,,,,,,,,,,,,,,,,,,,,,,,,,,,,,,,,,,,,
The Data Portability Cooperation Specification ,"The Data Portability Cooperation
The DPC is an inclusive working group led by GSMA and major European Telecommunications operators Orange: Telefónica and Deutsche Telekom to build the first specification of personal data portability for the telco industry.
The initiative is open by nature and encourage other telecommunication operators to join the discussions within the GSMA or the other industries to contribute by contacting us",https://www.dataportabilitycooperation.org/specification.html,specification,,,Data Portability,,,,,,,,,,,,,,,,,,,,,,,,,,,,,,,,,,,,,,,,,,,,,,,,,,,,,,,,,,,,,,,,,,,,,,,,,,,,,,,,,,,,,,,,,,,,,,,,,,,,,,,,,,,,,,,,,,,,,,,,,,,,,,,,,,,,,,,,,,,,,,,,,,,,,,,,,,,,,,,,,,,,,,,,,,,,,,,,,,,,,
Trust Framework & Code of Conduct ,Enabling consumers and their authorized caregivers to access more of their digital health information with less friction.,https://www.carinalliance.com/our-work/trust-framework-and-code-of-conduct/ ,Trust Framework: Code of Conduct,,,,,,,,CARIN Alliance,,,,,,,,,,,,,,,,,,,,,,,,,,,,,,,,,,,,,,,,,,,,,,,,,,,,,,,,,,,,,,,,,,,,,,,,,,,,,,,,,,,,,,,,,,,,,,,,,,,,,,,,,,,,,,,,,,,,,,,,,,,,,,,,,,,,,,,,,,,,,,,,,,,,,,,,,,,,,,,,,,,,,,,,,,,,,,,,
,,,,,,,,,,,,,,,,,,,,,,,,,,,,,,,,,,,,,,,,,,,,,,,,,,,,,,,,,,,,,,,,,,,,,,,,,,,,,,,,,,,,,,,,,,,,,,,,,,,,,,,,,,,,,,,,,,,,,,,,,,,,,,,,,,,,,,,,,,,,,,,,,,,,,,,,,,,,,,,,,,,,,,,,,,,,,,,,,,,,,,,,,,,
ALGORITHMIC ACCOUNTABILITY: A PRIMER,There are few consumer or civil rights protections that limit the types of data used to build data profiles or that require the auditing of algorithmic decision-making.,https://datasociety.net/output/algorithmic-accountability-a-primer/,,,,,,,,,Data & Society Research Institute,,Robyn Caplan: Joan Donovan: Lauren Hanson: and Jeanna Matthews,,,,,,,,,,,,,,,,,,,,,,,,,,,,,,,,,,,,,,,,,,,,,,,,,,,,,,,,,,,,,,,,,,,,,,,,,,,,,,,,,,,,,,,,,,,,,,,,,,,,,,,,,,,,,,,,,,,,,,,,,,,,,,,,,,,,,,,,,,,,,,,,,,,,,,,,,,,,,,,,,,,,,,,,,,,,,,
The Trustable Technology Mark,The Trustable Technology Mark aims to highlight the work of those companies that put in the extra effort of building truly trustworthy devices.,https://trustabletech.org/about/,certification: trust framework,,,,,,,,,,Peter Bihr,,,,,,,,,,,,,,,,,,,,,,,,,,,,,,,,,,,,,,,,,,,,,,,,,,,,,,,,,,,,,,,,,,,,,,,,,,,,,,,,,,,,,,,,,,,,,,,,,,,,,,,,,,,,,,,,,,,,,,,,,,,,,,,,,,,,,,,,,,,,,,,,,,,,,,,,,,,,,,,,,,,,,,,,,,,,,,
English French Dictionary on Data Protection ,English French glossary on data protection,https://www.cnil.fr/en/english-french-glossary-data-protection,Translation Diectionary,,,,,,,,,,,,,,,,,,,,,,,,,,,,,,,,,,,,,,,,,,,,,,,,,,,,,,,,,,,,,,,,,,,,,,,,,,,,,,,,,,,,,,,,,,,,,,,,,,,,,,,,,,,,,,,,,,,,,,,,,,,,,,,,,,,,,,,,,,,,,,,,,,,,,,,,,,,,,,,,,,,,,,,,,,,,,,,,,,,,,,,,
B Corporation,,https://bcorporation.net/certification,,,,,,,,,B Corporation,,,,,,,,,,,,,,,,,,,,,,,,,,,,,,,,,,,,,,,,,,,,,,,,,,,,,,,,,,,,,,,,,,,,,,,,,,,,,,,,,,,,,,,,,,,,,,,,,,,,,,,,,,,,,,,,,,,,,,,,,,,,,,,,,,,,,,,,,,,,,,,,,,,,,,,,,,,,,,,,,,,,,,,,,,,,,,,,
WorldBank  Identity Principles,,http://documents.worldbank.org/curated/en/213581486378184357/Principles-on-identification-for-sustainable-development-toward-the-digital-age,,,,Identity,,,,,,,,,,,,,,,,,,,,,,,,,,,,,,,,,,,,,,,,,,,,,,,,,,,,,,,,,,,,,,,,,,,,,,,,,,,,,,,,,,,,,,,,,,,,,,,,,,,,,,,,,,,,,,,,,,,,,,,,,,,,,,,,,,,,,,,,,,,,,,,,,,,,,,,,,,,,,,,,,,,,,,,,,,,,,,,,,,,,,
Declaration of Digital Independence,Humanity has been contemptuously used by vast digital empires. Thus it is now necessary to replace these empires with decentralized networks of independent individuals: as in the first decades of the Internet. As our participation has been voluntary: no one doubts our right to take this step. But if we are to persuade as many people as possible to join together and make reformed networks possible: we should declare our reasons for wanting to replace the old.,https://larrysanger.org/2019/06/declaration-of-digital-independence/,,,,,,,,,,,,,,,,,,,,,,,,,,,,,,,,,,,,,,,,,,,,,,,,,,,,,,,,,,,,,,,,,,,,,,,,,,,,,,,,,,,,,,,,,,,,,,,,,,,,,,,,,,,,,,,,,,,,,,,,,,,,,,,,,,,,,,,,,,,,,,,,,,,,,,,,,,,,,,,,,,,,,,,,,,,,,,,,,,,,,,,,,
Privacy Tech White Paper,,https://www.anewgovernance.org/executive-summary-privacytech-white-paper/,,,,,,,,,,,,,,,,,,,,,,,,,,,,,,,,,,,,,,,,,,,,,,,,,,,,,,,,,,,,,,,,,,,,,,,,,,,,,,,,,,,,,,,,,,,,,,,,,,,,,,,,,,,,,,,,,,,,,,,,,,,,,,,,,,,,,,,,,,,,,,,,,,,,,,,,,,,,,,,,,,,,,,,,,,,,,,,,,,,,,,,,,
UN Data Interoperability Guide,The Collaborative on SDG Data Interoperability will continue to build and maintain the Guide in this electronic space as it develops as a tool: adding new modules and examples as well as ancillary materials to help raise awareness of its existence and usability.It is hoped that new synergies will form between data producers: publishers: users: and those providing capacity building and training. In this way: the guidance set out within the Guide can be incorporated into existing training materials and modules: and a consistent approach to the system-wide improvement of data interoperability can start to become a reality in the development sector.,https://unstats.un.org/wiki/display/InteropGuide/Home,,,,,,,,,,,,,,,,,,,,,,,,,,,,,,,,,,,,,,,,,,,,,,,,,,,,,,,,,,,,,,,,,,,,,,,,,,,,,,,,,,,,,,,,,,,,,,,,,,,,,,,,,,,,,,,,,,,,,,,,,,,,,,,,,,,,,,,,,,,,,,,,,,,,,,,,,,,,,,,,,,,,,,,,,,,,,,,,,,,,,,,,,
CINL,Papers ,https://www.cnil.fr/en/media,,,,,,,,,,,,,,,,,,,,,,,,,,,,,,,,,,,,,,,,,,,,,,,,,,,,,,,,,,,,,,,,,,,,,,,,,,,,,,,,,,,,,,,,,,,,,,,,,,,,,,,,,,,,,,,,,,,,,,,,,,,,,,,,,,,,,,,,,,,,,,,,,,,,,,,,,,,,,,,,,,,,,,,,,,,,,,,,,,,,,,,,,
Open Data Kit Code of Conduct ,,https://github.com/opendatakit/governance/blob/master/CODE-OF-CONDUCT.md,,,,,,,,,,,,,,,,,,,,,,,,,,,,,,,,,,,,,,,,,,,,,,,,,,,,,,,,,,,,,,,,,,,,,,,,,,,,,,,,,,,,,,,,,,,,,,,,,,,,,,,,,,,,,,,,,,,,,,,,,,,,,,,,,,,,,,,,,,,,,,,,,,,,,,,,,,,,,,,,,,,,,,,,,,,,,,,,,,,,,,,,,
ICO Data Sharing Code of Practice,,https://ico.org.uk/media/about-the-ico/consultations/2615361/data-sharing-code-for-public-consultation.pdf,,,,,,,,,,,,,,,,,,,,,,,,,,,,,,,,,,,,,,,,,,,,,,,,,,,,,,,,,,,,,,,,,,,,,,,,,,,,,,,,,,,,,,,,,,,,,,,,,,,,,,,,,,,,,,,,,,,,,,,,,,,,,,,,,,,,,,,,,,,,,,,,,,,,,,,,,,,,,,,,,,,,,,,,,,,,,,,,,,,,,,,,,
Privacy Patterns ,,https://privacypatterns.org/patterns/,,,,,,,,,,,,,,,,,,,,,,,,,,,,,,,,,,,,,,,,,,,,,,,,,,,,,,,,,,,,,,,,,,,,,,,,,,,,,,,,,,,,,,,,,,,,,,,,,,,,,,,,,,,,,,,,,,,,,,,,,,,,,,,,,,,,,,,,,,,,,,,,,,,,,,,,,,,,,,,,,,,,,,,,,,,,,,,,,,,,,,,,,
A tiered-layered-staged model for informed consent in personal genome testing,,https://www.ncbi.nlm.nih.gov/pmc/articles/PMC3658183/,,,,,,,,,,,,,,,,,,,,,,,,,,,,,,,,,,,,,,,,,,,,,,,,,,,,,,,,,,,,,,,,,,,,,,,,,,,,,,,,,,,,,,,,,,,,,,,,,,,,,,,,,,,,,,,,,,,,,,,,,,,,,,,,,,,,,,,,,,,,,,,,,,,,,,,,,,,,,,,,,,,,,,,,,,,,,,,,,,,,,,,,,
Data Transfer Project Overview and Fundamentals,,https://datatransferproject.dev/dtp-overview.pdf,,,,,,,,,,,,,,,,,,,,,,,,,,,,,,,,,,,,,,,,,,,,,,,,,,,,,,,,,,,,,,,,,,,,,,,,,,,,,,,,,,,,,,,,,,,,,,,,,,,,,,,,,,,,,,,,,,,,,,,,,,,,,,,,,,,,,,,,,,,,,,,,,,,,,,,,,,,,,,,,,,,,,,,,,,,,,,,,,,,,,,,,,
Safe Face Pledge,The Safe Face Pledge is an opportunity for organizations to make public commitments towards mitigating the abuse of facial analysis technology. This historic pledge prohibits lethal use of the technology: lawless police use: and requires transparency in any government use.,https://www.safefacepledge.org,,,,,,,,,Algorithmic Justice League;  the Center on Technology & Privacy at Georgetown Law,,,,,,,,,,,,,,,,,,,,,,,,,,,,,,,,,,,,,,,,,,,,,,,,,,,,,,,,,,,,,,,,,,,,,,,,,,,,,,,,,,,,,,,,,,,,,,,,,,,,,,,,,,,,,,,,,,,,,,,,,,,,,,,,,,,,,,,,,,,,,,,,,,,,,,,,,,,,,,,,,,,,,,,,,,,,,,,,
,,,,,,,,,,,,,,,,,,,,,,,,,,,,,,,,,,,,,,,,,,,,,,,,,,,,,,,,,,,,,,,,,,,,,,,,,,,,,,,,,,,,,,,,,,,,,,,,,,,,,,,,,,,,,,,,,,,,,,,,,,,,,,,,,,,,,,,,,,,,,,,,,,,,,,,,,,,,,,,,,,,,,,,,,,,,,,,,,,,,,,,,,,,
A people's guide to AI,,https://alliedmedia.org/peoples-ai#,,,,,,,,,Allied Media Project,,,,,,,,,,,,,,,,,,,,,,,,,,,,,,,,,,,,,,,,,,,,,,,,,,,,,,,,,,,,,,,,,,,,,,,,,,,,,,,,,,,,,,,,,,,,,,,,,,,,,,,,,,,,,,,,,,,,,,,,,,,,,,,,,,,,,,,,,,,,,,,,,,,,,,,,,,,,,,,,,,,,,,,,,,,,,,,,
Design Justice Principles,,https://designjusticenetwork.org/read-the-principles,,,,,,,,,,,,,,,,,,,,,,,,,,,,,,,,,,,,,,,,,,,,,,,,,,,,,,,,,,,,,,,,,,,,,,,,,,,,,,,,,,,,,,,,,,,,,,,,,,,,,,,,,,,,,,,,,,,,,,,,,,,,,,,,,,,,,,,,,,,,,,,,,,,,,,,,,,,,,,,,,,,,,,,,,,,,,,,,,,,,,,,,,
Our Data Bodies Playbook,Our Data Bodies (ODB) has conducted research and produced a workbook of popular education activities focused on data: surveillance: and community safety to co-create and share knowledge: analyses: and tools for data justice and data access for equity. We hope that our work will enhance trusted models of community health and safety and help illuminate the differences between being safe and being secure.,https://alliedmedia.org/news/2019/02/07/our-data-bodies-playbook-out,,,,,,,,,,,,,,,,,,,,,,,,,,,,,,,,,,,,,,,,,,,,,,,,,,,,,,,,,,,,,,,,,,,,,,,,,,,,,,,,,,,,,,,,,,,,,,,,,,,,,,,,,,,,,,,,,,,,,,,,,,,,,,,,,,,,,,,,,,,,,,,,,,,,,,,,,,,,,,,,,,,,,,,,,,,,,,,,,,,,,,,,,
MOre then Code Database,,https://morethancode.cc/orglist/,,,,,,,,,,,,,,,,,,,,,,,,,,,,,,,,,,,,,,,,,,,,,,,,,,,,,,,,,,,,,,,,,,,,,,,,,,,,,,,,,,,,,,,,,,,,,,,,,,,,,,,,,,,,,,,,,,,,,,,,,,,,,,,,,,,,,,,,,,,,,,,,,,,,,,,,,,,,,,,,,,,,,,,,,,,,,,,,,,,,,,,,,
Information Fiduciary Consortium,,https://berkmancenter.github.io/datatransparency/ifc-brief.pdf,,,,,,,,,,,,,,,,,,,,,,,,,,,,,,,,,,,,,,,,,,,,,,,,,,,,,,,,,,,,,,,,,,,,,,,,,,,,,,,,,,,,,,,,,,,,,,,,,,,,,,,,,,,,,,,,,,,,,,,,,,,,,,,,,,,,,,,,,,,,,,,,,,,,,,,,,,,,,,,,,,,,,,,,,,,,,,,,,,,,,,,,,
Strategic Plan: Trustless Computing Certification Body and the Seevik Net Ecosystem,,https://static1.squarespace.com/static/59c38d4c9f8dcee4a34ddcf6/t/5d96233db2c2e2229198da4d/1570120517291/tca-tccb-strategic-plan.pdf,,,,,,,,,,,,,,,,,,,,,,,,,,,,,,,,,,,,,,,,,,,,,,,,,,,,,,,,,,,,,,,,,,,,,,,,,,,,,,,,,,,,,,,,,,,,,,,,,,,,,,,,,,,,,,,,,,,,,,,,,,,,,,,,,,,,,,,,,,,,,,,,,,,,,,,,,,,,,,,,,,,,,,,,,,,,,,,,,,,,,,,,,
The Tech Pledge,,https://www.techpledge.org/#!,,,,,,,,,,,,,,,,,,,,,,,,,,,,,,,,,,,,,,,,,,,,,,,,,,,,,,,,,,,,,,,,,,,,,,,,,,,,,,,,,,,,,,,,,,,,,,,,,,,,,,,,,,,,,,,,,,,,,,,,,,,,,,,,,,,,,,,,,,,,,,,,,,,,,,,,,,,,,,,,,,,,,,,,,,,,,,,,,,,,,,,,,
NIST Privacy Framework,,https://www.nist.gov/privacy-framework,,,,,,,,,,,,,,,,,,,,,,,,,,,,,,,,,,,,,,,,,,,,,,,,,,,,,,,,,,,,,,,,,,,,,,,,,,,,,,,,,,,,,,,,,,,,,,,,,,,,,,,,,,,,,,,,,,,,,,,,,,,,,,,,,,,,,,,,,,,,,,,,,,,,,,,,,,,,,,,,,,,,,,,,,,,,,,,,,,,,,,,,,
Network Advertising Initiative Code of Conduct,,https://www.networkadvertising.org/sites/default/files/nai_code2018.pdf,,,,,,,,,Network Advertising Initiative,,,,,,,,,,,,,,,,,,,,,,,,,,,,,,,,,,,,,,,,,,,,,,,,,,,,,,,,,,,,,,,,,,,,,,,,,,,,,,,,,,,,,,,,,,,,,,,,,,,,,,,,,,,,,,,,,,,,,,,,,,,,,,,,,,,,,,,,,,,,,,,,,,,,,,,,,,,,,,,,,,,,,,,,,,,,,,,,
Consumer protection: Privacy by design for consumer goods and services,To provide a standard whereby product (i.e. goods and services) designers and providers can demonstrate through consumer protection fulfilling the need to protect consumers from fraud: ransom demands: and other forms of privacy invasion and privacy breaking exploits resulting from lost and stolen personal data and high-jacking of consumer devices. Particularly of concern is the protection of children and the more vulnerable consumer.,https://iapp.org/media/pdf/resource_center/ISO%20NWIP%20(Privacy%20by%20design%20for%20consumer%20goods%20and%20services).pdf,,,,,,,,,COPOLCO,,,,,,,,,,,,,,,,,,,,,,,,,,,,,,,,,,,,,,,,,,,,,,,,,,,,,,,,,,,,,,,,,,,,,,,,,,,,,,,,,,,,,,,,,,,,,,,,,,,,,,,,,,,,,,,,,,,,,,,,,,,,,,,,,,,,,,,,,,,,,,,,,,,,,,,,,,,,,,,,,,,,,,,,,,,,,,,,
,,https://www.iso.org/files/live/sites/isoorg/files/store/en/PUB100433.pdf,,,,,,,,,,,,,,,,,,,,,,,,,,,,,,,,,,,,,,,,,,,,,,,,,,,,,,,,,,,,,,,,,,,,,,,,,,,,,,,,,,,,,,,,,,,,,,,,,,,,,,,,,,,,,,,,,,,,,,,,,,,,,,,,,,,,,,,,,,,,,,,,,,,,,,,,,,,,,,,,,,,,,,,,,,,,,,,,,,,,,,,,,
CAPrice - Collective Awareness Platform for Privacy Concerns and Expectations Video ,,https://youtu.be/4L8gOfU9MXg,,,,,,,,,,,,,,,,,,,,,,,,,,,,,,,,,,,,,,,,,,,,,,,,,,,,,,,,,,,,,,,,,,,,,,,,,,,,,,,,,,,,,,,,,,,,,,,,,,,,,,,,,,,,,,,,,,,,,,,,,,,,,,,,,,,,,,,,,,,,,,,,,,,,,,,,,,,,,,,,,,,,,,,,,,,,,,,,,,,,,,,,,
IDS REFERENCE ARCHITECTURE MODEL: INDUSTRIAL DATA SPACE,,https://www.internationaldataspaces.org/wp-content/uploads/dlm_uploads/2018/04/InternationalDataSpacesAssociation_ReferenzArchitecture2.0.pdf,,,,,,,,,International Data Spaces Association,,,,,,,,Version 2.0,,,,,,,,,,,,,,,,,,,,,,,,,,,,,,,,,,,,,,,,,,,,,,,,,,,,,,,,,,,,,,,,,,,,,,,,,,,,,,,,,,,,,,,,,,,,,,,,,,,,,,,,,,,,,,,,,,,,,,,,,,,,,,,,,,,,,,,,,,,,,,,,,,,,,,,,,,,,,,,,,,,,,,,,
,,,,,,,,,,,,,,,,,,,,,,,,,,,,,,,,,,,,,,,,,,,,,,,,,,,,,,,,,,,,,,,,,,,,,,,,,,,,,,,,,,,,,,,,,,,,,,,,,,,,,,,,,,,,,,,,,,,,,,,,,,,,,,,,,,,,,,,,,,,,,,,,,,,,,,,,,,,,,,,,,,,,,,,,,,,,,,,,,,,,,,,,,,,
INDUSTRIAL DATA SPACE,,,,,,,,,,,,,,,,,,,,,,,,,,,,,,,,,,,,,,,,,,,,,,,,,,,,,,,,,,,,,,,,,,,,,,,,,,,,,,,,,,,,,,,,,,,,,,,,,,,,,,,,,,,,,,,,,,,,,,,,,,,,,,,,,,,,,,,,,,,,,,,,,,,,,,,,,,,,,,,,,,,,,,,,,,,,,,,,,,,,,,,,,,,
Do No Harm Open Source License,,https://github.com/raisely/NoHarm,,,,,,,,,,,,,,,,,,,,,,,,,,,,https://github.com/raisely/NoHarm,,,,,,,,,,,,,,,,,,,,,,,,,,,,,,,,,,,,,,,,,,,,,,,,,,,,,,,,,,,,,,,,,,,,,,,,,,,,,,,,,,,,,,,,,,,,,,,,,,,,,,,,,,,,,,,,,,,,,,,,,,,,,,,,,,,,,,,,,,,,,,,,,,,,,,,,,,,,,
Classification of Everyday Living V1.0 COEL,COEL is a hierarchical taxonomy of everyday human life events. It provides a privacy-by-design framework for collecting and processing behavioral data that is uniquely suited to the transparent use of dynamic data for personalized digital services: IoT applications where devices are collecting information about identifiable individuals: and the coding of behavioral data in identity solutions.,http://docs.oasis-open.org/coel/COEL/v1.0/cs02/COEL-v1.0-cs02.pdf,,,,,,,,,,,,,,,,,,,,,,,,,,,,,,,,,,,,,,,,,,,,,,,,,,,,,,,,,,,,,,,,,,,,,,,,,,,,,,,,,,,,,,,,,,,,,,,,,,,,,,,,,,,,,,,,,,,,,,,,,,,,,,,,,,,,,,,,,,,,,,,,,,,,,,,,,,,,,,,,,,,,,,,,,,,,,,,,,,,,,,,,,
Visualizing Life,COELATION model visualized COEL ,https://coelition.org/business/resources/visualising-life/,,,,,,,,,,,,,,,,,,,,,,,,,,,,,,,,,,,,,,,,,,,,,,,,,,,,,,,,,,,,,,,,,,,,,,,,,,,,,,,,,,,,,,,,,,,,,,,,,,,,,,,,,,,,,,,,,,,,,,,,,,,,,,,,,,,,,,,,,,,,,,,,,,,,,,,,,,,,,,,,,,,,,,,,,,,,,,,,,,,,,,,,,
B Corporation,,https://bcorporation.net/certification,,,Certification,,,,,,,,,,,,,,,,,,,,,,,,,,,,,,,,,,,,,,,,,,,,,,,,,,,,,,,,,,,,,,,,,,,,,,,,,,,,,,,,,,,,,,,,,,,,,,,,,,,,,,,,,,,,,,,,,,,,,,,,,,,,,,,,,,,,,,,,,,,,,,,,,,,,,,,,,,,,,,,,,,,,,,,,,,,,,,,,,,,,,,
,,,,,,,,,,,,,,,,,,,,,,,,,,,,,,,,,,,,,,,,,,,,,,,,,,,,,,,,,,,,,,,,,,,,,,,,,,,,,,,,,,,,,,,,,,,,,,,,,,,,,,,,,,,,,,,,,,,,,,,,,,,,,,,,,,,,,,,,,,,,,,,,,,,,,,,,,,,,,,,,,,,,,,,,,,,,,,,,,,,,,,,,,,,
,,,,,,,,,,,,,,,,,,,,,,,,,,,,,,,,,,,,,,,,,,,,,,,,,,,,,,,,,,,,,,,,,,,,,,,,,,,,,,,,,,,,,,,,,,,,,,,,,,,,,,,,,,,,,,,,,,,,,,,,,,,,,,,,,,,,,,,,,,,,,,,,,,,,,,,,,,,,,,,,,,,,,,,,,,,,,,,,,,,,,,,,,,,
,,,,,,,,,,,,,,,,,,,,,,,,,,,,,,,,,,,,,,,,,,,,,,,,,,,,,,,,,,,,,,,,,,,,,,,,,,,,,,,,,,,,,,,,,,,,,,,,,,,,,,,,,,,,,,,,,,,,,,,,,,,,,,,,,,,,,,,,,,,,,,,,,,,,,,,,,,,,,,,,,,,,,,,,,,,,,,,,,,,,,,,,,,,
,,,,,,,,,,,,,,,,,,,,,,,,,,,,,,,,,,,,,,,,,,,,,,,,,,,,,,,,,,,,,,,,,,,,,,,,,,,,,,,,,,,,,,,,,,,,,,,,,,,,,,,,,,,,,,,,,,,,,,,,,,,,,,,,,,,,,,,,,,,,,,,,,,,,,,,,,,,,,,,,,,,,,,,,,,,,,,,,,,,,,,,,,,,
,,,,,,,,,,,,,,,,,,,,,,,,,,,,,,,,,,,,,,,,,,,,,,,,,,,,,,,,,,,,,,,,,,,,,,,,,,,,,,,,,,,,,,,,,,,,,,,,,,,,,,,,,,,,,,,,,,,,,,,,,,,,,,,,,,,,,,,,,,,,,,,,,,,,,,,,,,,,,,,,,,,,,,,,,,,,,,,,,,,,,,,,,,,
,,,,,,,,,,,,,,,,,,,,,,,,,,,,,,,,,,,,,,,,,,,,,,,,,,,,,,,,,,,,,,,,,,,,,,,,,,,,,,,,,,,,,,,,,,,,,,,,,,,,,,,,,,,,,,,,,,,,,,,,,,,,,,,,,,,,,,,,,,,,,,,,,,,,,,,,,,,,,,,,,,,,,,,,,,,,,,,,,,,,,,,,,,,
,,,,,,,,,,,,,,,,,,,,,,,,,,,,,,,,,,,,,,,,,,,,,,,,,,,,,,,,,,,,,,,,,,,,,,,,,,,,,,,,,,,,,,,,,,,,,,,,,,,,,,,,,,,,,,,,,,,,,,,,,,,,,,,,,,,,,,,,,,,,,,,,,,,,,,,,,,,,,,,,,,,,,,,,,,,,,,,,,,,,,,,,,,,
,,,,,,,,,,,,,,,,,,,,,,,,,,,,,,,,,,,,,,,,,,,,,,,,,,,,,,,,,,,,,,,,,,,,,,,,,,,,,,,,,,,,,,,,,,,,,,,,,,,,,,,,,,,,,,,,,,,,,,,,,,,,,,,,,,,,,,,,,,,,,,,,,,,,,,,,,,,,,,,,,,,,,,,,,,,,,,,,,,,,,,,,,,,
,,,,,,,,,,,,,,,,,,,,,,,,,,,,,,,,,,,,,,,,,,,,,,,,,,,,,,,,,,,,,,,,,,,,,,,,,,,,,,,,,,,,,,,,,,,,,,,,,,,,,,,,,,,,,,,,,,,,,,,,,,,,,,,,,,,,,,,,,,,,,,,,,,,,,,,,,,,,,,,,,,,,,,,,,,,,,,,,,,,,,,,,,,,
,,,,,,,,,,,,,,,,,,,,,,,,,,,,,,,,,,,,,,,,,,,,,,,,,,,,,,,,,,,,,,,,,,,,,,,,,,,,,,,,,,,,,,,,,,,,,,,,,,,,,,,,,,,,,,,,,,,,,,,,,,,,,,,,,,,,,,,,,,,,,,,,,,,,,,,,,,,,,,,,,,,,,,,,,,,,,,,,,,,,,,,,,,,
,,,,,,,,,,,,,,,,,,,,,,,,,,,,,,,,,,,,,,,,,,,,,,,,,,,,,,,,,,,,,,,,,,,,,,,,,,,,,,,,,,,,,,,,,,,,,,,,,,,,,,,,,,,,,,,,,,,,,,,,,,,,,,,,,,,,,,,,,,,,,,,,,,,,,,,,,,,,,,,,,,,,,,,,,,,,,,,,,,,,,,,,,,,
RWoT PAPERS,Workshops: collaborative whitepapers to advance the conversation.,https://www.weboftrust.info/,Paper,,,,,,,,Rebooting the Web of Trust,,,,,,,,,,,,,,,,,,,,,,,,,,,,,,,,,,,,,,,,,,,,,,,,,,,,,,,,,,,,,,,,,,,,,,,,,,,,,,,,,,,,,,,,,,,,,,,,,,,,,,,,,,,,,,,,,,,,,,,,,,,,,,,,,,,,,,,,,,,,,,,,,,,,,,,,,,,,,,,,,,,,,,,,,,,,,,,,
Data & Society Research Institute,Research: Papers,https://datasociety.net/,,,,,,,,,,,,,,,,,,,,,,,,,,,,,,,,,,,,,,,,,,,,,,,,,,,,,,,,,,,,,,,,,,,,,,,,,,,,,,,,,,,,,,,,,,,,,,,,,,,,,,,,,,,,,,,,,,,,,,,,,,,,,,,,,,,,,,,,,,,,,,,,,,,,,,,,,,,,,,,,,,,,,,,,,,,,,,,,,,,,,,,,,
Alessandro Acquisti,Research: Papers,https://www.heinz.cmu.edu/~acquisti/papers.htm#TechnicalReports,,,,,,,,,,,,,,,,,,,,,,,,,,,,,,,,,,,,,,,,,,,,,,,,,,,,,,,,,,,,,,,,,,,,,,,,,,,,,,,,,,,,,,,,,,,,,,,,,,,,,,,,,,,,,,,,,,,,,,,,,,,,,,,,,,,,,,,,,,,,,,,,,,,,,,,,,,,,,,,,,,,,,,,,,,,,,,,,,,,,,,,,,
Algorythmic Justice League Videos,,https://www.ajlunited.org/resources,,,,,,,,,Algorythmic Justice League,,,,,,,,,,,,,,,,,,,,,,,,,,,,,,,,,,,,,,,,,,,,,,,,,,,,,,,,,,,,,,,,,,,,,,,,,,,,,,,,,,,,,,,,,,,,,,,,,,,,,,,,,,,,,,,,,,,,,,,,,,,,,,,,,,,,,,,,,,,,,,,,,,,,,,,,,,,,,,,,,,,,,,,,,,,,,,,,
Film Festival by Auditing Algory,VIDEOS,http://auditingalgorithms.science/?p=264,,,,,,,,,,,,,,,,,,,,,,,,,,,,,,,,,,,,,,,,,,,,,,,,,,,,,,,,,,,,,,,,,,,,,,,,,,,,,,,,,,,,,,,,,,,,,,,,,,,,,,,,,,,,,,,,,,,,,,,,,,,,,,,,,,,,,,,,,,,,,,,,,,,,,,,,,,,,,,,,,,,,,,,,,,,,,,,,,,,,,,,,,
